{
  "schemaVersion": 2,
  "id": "example-cantilever",
  "name": "Cantilever beam",
  "revision": 0,
  "displayUnits": "mm",
  "geometry": {
    "kind": "box",
    "length": 0.2,
    "width": 0.04,
    "height": 0.02,
    "radius": 0.02,
    "thickness": 0.012
  },
  "study": {
    "id": "study-cantilever",
    "type": "linear-static",
    "material": {
      "name": "Generic elastic material",
      "young": 70000000000,
      "poisson": 0.3
    },
    "mesh": {
      "size": 0.012
    },
    "constraints": [
      {
        "id": "support-root",
        "name": "Fixed root",
        "regions": [
          "x0"
        ],
        "components": [
          0,
          0,
          0
        ]
      }
    ],
    "loads": [
      {
        "id": "load-tip",
        "name": "Tip force",
        "kind": "force",
        "regions": [
          "x1"
        ],
        "vector": [
          0,
          0,
          -100
        ],
        "pressure": 0
      }
    ],
    "dimension": "3d",
    "formulation": "solid",
    "thickness": 0.02,
    "solver": {
      "kind": "fem",
      "pinn": {
        "layers": 3,
        "width": 32,
        "activation": "tanh",
        "optimizer": "adam",
        "learningRate": 0.001,
        "steps": 1000,
        "interiorPoints": 128,
        "boundaryPoints": 32,
        "seed": 42,
        "device": "auto"
      }
    }
  }
}
